"No.","Time","Source","Destination","Protocol","Length","Info"
"1","0.000000000","Routerbo_1c:8b:bd","Spanning-tree-(for-bridges)_00","STP","60","RST. Root = 32768/0/c4:ad:34:1c:8b:bd  Cost = 0  Port = 0x8001"
"2","2.002143019","Routerbo_1c:8b:bd","Spanning-tree-(for-bridges)_00","STP","60","RST. Root = 32768/0/c4:ad:34:1c:8b:bd  Cost = 0  Port = 0x8001"
"3","4.004329636","Routerbo_1c:8b:bd","Spanning-tree-(for-bridges)_00","STP","60","RST. Root = 32768/0/c4:ad:34:1c:8b:bd  Cost = 0  Port = 0x8001"
"4","6.006527022","Routerbo_1c:8b:bd","Spanning-tree-(for-bridges)_00","STP","60","RST. Root = 32768/0/c4:ad:34:1c:8b:bd  Cost = 0  Port = 0x8001"
"5","8.008744537","Routerbo_1c:8b:bd","Spanning-tree-(for-bridges)_00","STP","60","RST. Root = 32768/0/c4:ad:34:1c:8b:bd  Cost = 0  Port = 0x8001"
"6","10.010931613","Routerbo_1c:8b:bd","Spanning-tree-(for-bridges)_00","STP","60","RST. Root = 32768/0/c4:ad:34:1c:8b:bd  Cost = 0  Port = 0x8001"
"7","12.013129877","Routerbo_1c:8b:bd","Spanning-tree-(for-bridges)_00","STP","60","RST. Root = 32768/0/c4:ad:34:1c:8b:bd  Cost = 0  Port = 0x8001"
"8","14.015334787","Routerbo_1c:8b:bd","Spanning-tree-(for-bridges)_00","STP","60","RST. Root = 32768/0/c4:ad:34:1c:8b:bd  Cost = 0  Port = 0x8001"
"9","16.017541874","Routerbo_1c:8b:bd","Spanning-tree-(for-bridges)_00","STP","60","RST. Root = 32768/0/c4:ad:34:1c:8b:bd  Cost = 0  Port = 0x8001"
"10","18.019777886","Routerbo_1c:8b:bd","Spanning-tree-(for-bridges)_00","STP","60","RST. Root = 32768/0/c4:ad:34:1c:8b:bd  Cost = 0  Port = 0x8001"
"11","20.021933450","Routerbo_1c:8b:bd","Spanning-tree-(for-bridges)_00","STP","60","RST. Root = 32768/0/c4:ad:34:1c:8b:bd  Cost = 0  Port = 0x8001"
"12","22.024105644","Routerbo_1c:8b:bd","Spanning-tree-(for-bridges)_00","STP","60","RST. Root = 32768/0/c4:ad:34:1c:8b:bd  Cost = 0  Port = 0x8001"
"13","24.026291467","Routerbo_1c:8b:bd","Spanning-tree-(for-bridges)_00","STP","60","RST. Root = 32768/0/c4:ad:34:1c:8b:bd  Cost = 0  Port = 0x8001"
"14","26.028457743","Routerbo_1c:8b:bd","Spanning-tree-(for-bridges)_00","STP","60","RST. Root = 32768/0/c4:ad:34:1c:8b:bd  Cost = 0  Port = 0x8001"
"15","28.030635831","Routerbo_1c:8b:bd","Spanning-tree-(for-bridges)_00","STP","60","RST. Root = 32768/0/c4:ad:34:1c:8b:bd  Cost = 0  Port = 0x8001"
"16","30.032798769","Routerbo_1c:8b:bd","Spanning-tree-(for-bridges)_00","STP","60","RST. Root = 32768/0/c4:ad:34:1c:8b:bd  Cost = 0  Port = 0x8001"
"17","32.034965205","Routerbo_1c:8b:bd","Spanning-tree-(for-bridges)_00","STP","60","RST. Root = 32768/0/c4:ad:34:1c:8b:bd  Cost = 0  Port = 0x8001"
"18","33.081848125","172.16.40.1","172.16.1.10","TCP","74","38202  >  21 [SYN] Seq=0 Win=64240 Len=0 MSS=1460 SACK_PERM=1 TSval=3491549824 TSecr=0 WS=128"
"19","33.082562485","172.16.1.10","172.16.40.1","TCP","74","21  >  38202 [SYN, ACK] Seq=0 Ack=1 Win=65160 Len=0 MSS=1460 SACK_PERM=1 TSval=2823992679 TSecr=3491549824 WS=128"
"20","33.082587699","172.16.40.1","172.16.1.10","TCP","66","38202  >  21 [ACK] Seq=1 Ack=1 Win=64256 Len=0 TSval=3491549825 TSecr=2823992679"
"21","33.087606515","172.16.1.10","172.16.40.1","FTP","116","Response: 220 ProFTPD Server (Debian) [::ffff:172.16.1.10]"
"22","33.087620064","172.16.40.1","172.16.1.10","TCP","66","38202  >  21 [ACK] Seq=1 Ack=51 Win=64256 Len=0 TSval=3491549830 TSecr=2823992684"
"23","33.087667488","172.16.40.1","172.16.1.10","FTP","77","Request: USER rcom"
"24","33.088075793","172.16.1.10","172.16.40.1","TCP","66","21  >  38202 [ACK] Seq=51 Ack=12 Win=65280 Len=0 TSval=2823992684 TSecr=3491549830"
"25","33.088835342","172.16.1.10","172.16.40.1","FTP","98","Response: 331 Password required for rcom"
"26","33.088874524","172.16.40.1","172.16.1.10","FTP","77","Request: PASS rcom"
"27","33.134260035","172.16.1.10","172.16.40.1","TCP","66","21  >  38202 [ACK] Seq=83 Ack=23 Win=65280 Len=0 TSval=2823992731 TSecr=3491549832"
"28","33.269347126","172.16.1.10","172.16.40.1","FTP","112","Response: 230-Welcome, archive user rcom@172.16.1.41 !"
"29","33.269378835","172.16.1.10","172.16.40.1","FTP","115","Response:  "
"30","33.269429961","172.16.40.1","172.16.1.10","FTP","72","Request: PASV"
"31","33.269449587","172.16.1.10","172.16.40.1","FTP","142","Response:  "
"32","33.269497569","172.16.1.10","172.16.40.1","FTP","157","Response:  please report them via e-mail to <root@ftp.netlab.fe.up.pt>."
"33","33.269515240","172.16.40.1","172.16.1.10","TCP","66","38202  >  21 [ACK] Seq=29 Ack=345 Win=64128 Len=0 TSval=3491550012 TSecr=2823992866"
"34","33.269740555","172.16.1.10","172.16.40.1","TCP","66","21  >  38202 [ACK] Seq=345 Ack=29 Win=65280 Len=0 TSval=2823992866 TSecr=3491550012"
"35","33.270443041","172.16.1.10","172.16.40.1","FTP","115","Response: 227 Entering Passive Mode (172,16,1,10,145,83)."
"36","33.313601522","172.16.40.1","172.16.1.10","TCP","66","38202  >  21 [ACK] Seq=29 Ack=394 Win=64128 Len=0 TSval=3491550056 TSecr=2823992867"
"37","34.037142264","Routerbo_1c:8b:bd","Spanning-tree-(for-bridges)_00","STP","60","RST. Root = 32768/0/c4:ad:34:1c:8b:bd  Cost = 0  Port = 0x8001"
"38","34.407184600","172.16.40.1","172.16.1.10","TCP","66","38202  >  21 [FIN, ACK] Seq=29 Ack=394 Win=64128 Len=0 TSval=3491551150 TSecr=2823992867"
"39","34.407856006","172.16.1.10","172.16.40.1","TCP","66","21  >  38202 [FIN, ACK] Seq=394 Ack=30 Win=65280 Len=0 TSval=2823994004 TSecr=3491551150"
"40","34.407878845","172.16.40.1","172.16.1.10","TCP","66","38202  >  21 [ACK] Seq=30 Ack=395 Win=64128 Len=0 TSval=3491551151 TSecr=2823994004"
"41","34.906290099","172.16.40.1","172.16.1.10","TCP","74","38214  >  21 [SYN] Seq=0 Win=64240 Len=0 MSS=1460 SACK_PERM=1 TSval=3491551649 TSecr=0 WS=128"
"42","34.906733186","172.16.1.10","172.16.40.1","TCP","74","21  >  38214 [SYN, ACK] Seq=0 Ack=1 Win=65160 Len=0 MSS=1460 SACK_PERM=1 TSval=2823994503 TSecr=3491551649 WS=128"
"43","34.906755257","172.16.40.1","172.16.1.10","TCP","66","38214  >  21 [ACK] Seq=1 Ack=1 Win=64256 Len=0 TSval=3491551649 TSecr=2823994503"
"44","34.911785248","172.16.1.10","172.16.40.1","FTP","116","Response: 220 ProFTPD Server (Debian) [::ffff:172.16.1.10]"
"45","34.911797540","172.16.40.1","172.16.1.10","TCP","66","38214  >  21 [ACK] Seq=1 Ack=51 Win=64256 Len=0 TSval=3491551654 TSecr=2823994508"
"46","34.912017268","172.16.40.1","172.16.1.10","FTP","77","Request: USER rcom"
"47","34.912326884","172.16.1.10","172.16.40.1","TCP","66","21  >  38214 [ACK] Seq=51 Ack=12 Win=65280 Len=0 TSval=2823994509 TSecr=3491551655"
"48","34.912967350","172.16.1.10","172.16.40.1","FTP","98","Response: 331 Password required for rcom"
"49","34.913088528","172.16.40.1","172.16.1.10","FTP","77","Request: PASS rcom"
"50","34.954209815","172.16.1.10","172.16.40.1","TCP","66","21  >  38214 [ACK] Seq=83 Ack=23 Win=65280 Len=0 TSval=2823994551 TSecr=3491551656"
"51","35.096475638","172.16.1.10","172.16.40.1","FTP","112","Response: 230-Welcome, archive user rcom@172.16.1.41 !"
"52","35.096484508","172.16.1.10","172.16.40.1","FTP","115","Response:  "
"53","35.096517753","172.16.40.1","172.16.1.10","TCP","66","38214  >  21 [ACK] Seq=23 Ack=178 Win=64256 Len=0 TSval=3491551839 TSecr=2823994693"
"54","35.096561545","172.16.1.10","172.16.40.1","FTP","205","Response:  "
"55","35.096585083","172.16.40.1","172.16.1.10","FTP","72","Request: PASV"
"56","35.096664844","172.16.1.10","172.16.40.1","FTP","94","Response:  "
"57","35.096924732","172.16.1.10","172.16.40.1","TCP","66","21  >  38214 [ACK] Seq=345 Ack=29 Win=65280 Len=0 TSval=2823994693 TSecr=3491551839"
"58","35.097352454","172.16.1.10","172.16.40.1","FTP","116","Response: 227 Entering Passive Mode (172,16,1,10,173,181)."
"59","35.097367540","172.16.40.1","172.16.1.10","TCP","66","38214  >  21 [ACK] Seq=29 Ack=395 Win=64128 Len=0 TSval=3491551840 TSecr=2823994693"
"60","35.877295882","0.0.0.0","255.255.255.255","MNDP","159","5678  >  5678 Len=117"
"61","35.877324029","Routerbo_1c:8b:bd","CDP/VTP/DTP/PAgP/UDLD","CDP","93","Device ID: MikroTik  Port ID: bridge40  "
"62","35.877372780","Routerbo_1c:8b:bd","LLDP_Multicast","LLDP","110","TTL = 120 System Name = MikroTik System Description = MikroTik RouterOS 6.43.16 (long-term) CRS326-24G-2S+ "
"63","35.895385567","172.16.40.1","172.16.1.10","TCP","66","38214  >  21 [FIN, ACK] Seq=29 Ack=395 Win=64128 Len=0 TSval=3491552638 TSecr=2823994693"
"64","35.896133172","172.16.1.10","172.16.40.1","TCP","66","21  >  38214 [FIN, ACK] Seq=395 Ack=30 Win=65280 Len=0 TSval=2823995493 TSecr=3491552638"
"65","35.896155731","172.16.40.1","172.16.1.10","TCP","66","38214  >  21 [ACK] Seq=30 Ack=396 Win=64128 Len=0 TSval=3491552639 TSecr=2823995493"
"66","36.039323729","Routerbo_1c:8b:bd","Spanning-tree-(for-bridges)_00","STP","60","RST. Root = 32768/0/c4:ad:34:1c:8b:bd  Cost = 0  Port = 0x8001"
"67","36.345905626","172.16.40.1","172.16.1.10","TCP","74","33450  >  21 [SYN] Seq=0 Win=64240 Len=0 MSS=1460 SACK_PERM=1 TSval=3491553089 TSecr=0 WS=128"
"68","36.346330066","172.16.1.10","172.16.40.1","TCP","74","21  >  33450 [SYN, ACK] Seq=0 Ack=1 Win=65160 Len=0 MSS=1460 SACK_PERM=1 TSval=2823995943 TSecr=3491553089 WS=128"
"69","36.346353812","172.16.40.1","172.16.1.10","TCP","66","33450  >  21 [ACK] Seq=1 Ack=1 Win=64256 Len=0 TSval=3491553089 TSecr=2823995943"
"70","36.351129504","172.16.1.10","172.16.40.1","FTP","116","Response: 220 ProFTPD Server (Debian) [::ffff:172.16.1.10]"
"71","36.351143612","172.16.40.1","172.16.1.10","TCP","66","33450  >  21 [ACK] Seq=1 Ack=51 Win=64256 Len=0 TSval=3491553094 TSecr=2823995947"
"72","36.351238111","172.16.40.1","172.16.1.10","FTP","77","Request: USER rcom"
"73","36.351582998","172.16.1.10","172.16.40.1","TCP","66","21  >  33450 [ACK] Seq=51 Ack=12 Win=65280 Len=0 TSval=2823995948 TSecr=3491553094"
"74","36.352240994","172.16.1.10","172.16.40.1","FTP","98","Response: 331 Password required for rcom"
"75","36.352303155","172.16.40.1","172.16.1.10","FTP","77","Request: PASS rcom"
"76","36.394169046","172.16.1.10","172.16.40.1","TCP","66","21  >  33450 [ACK] Seq=83 Ack=23 Win=65280 Len=0 TSval=2823995991 TSecr=3491553095"
"77","36.540130022","172.16.1.10","172.16.40.1","FTP","112","Response: 230-Welcome, archive user rcom@172.16.1.41 !"
"78","36.540131698","172.16.1.10","172.16.40.1","FTP","69","Response:  "
"79","36.540159146","172.16.1.10","172.16.40.1","FTP","112","Response:  The local time is: Fri Dec 13 11:39:50 2024"
"80","36.540187642","172.16.40.1","172.16.1.10","TCP","66","33450  >  21 [ACK] Seq=23 Ack=178 Win=64256 Len=0 TSval=3491553283 TSecr=2823996136"
"81","36.540246241","172.16.40.1","172.16.1.10","FTP","72","Request: PASV"
"82","36.541194577","172.16.1.10","172.16.40.1","FTP","142","Response:  "
"83","36.542189288","172.16.1.10","172.16.40.1","FTP","129","Response:  please report them via e-mail to <root@ftp.netlab.fe.up.pt>."
"84","36.542190476","172.16.1.10","172.16.40.1","FTP","94","Response:  "
"85","36.542213524","172.16.40.1","172.16.1.10","TCP","66","33450  >  21 [ACK] Seq=29 Ack=345 Win=64128 Len=0 TSval=3491553285 TSecr=2823996137"
"86","36.542574336","172.16.1.10","172.16.40.1","TCP","66","21  >  33450 [ACK] Seq=345 Ack=29 Win=65280 Len=0 TSval=2823996139 TSecr=3491553283"
"87","36.543090060","172.16.1.10","172.16.40.1","FTP","116","Response: 227 Entering Passive Mode (172,16,1,10,136,125)."
"88","36.585606474","172.16.40.1","172.16.1.10","TCP","66","33450  >  21 [ACK] Seq=29 Ack=395 Win=64128 Len=0 TSval=3491553328 TSecr=2823996139"
"89","37.255245972","172.16.40.1","172.16.1.10","TCP","66","33450  >  21 [FIN, ACK] Seq=29 Ack=395 Win=64128 Len=0 TSval=3491553998 TSecr=2823996139"
"90","37.255965640","172.16.1.10","172.16.40.1","TCP","66","21  >  33450 [FIN, ACK] Seq=395 Ack=30 Win=65280 Len=0 TSval=2823996852 TSecr=3491553998"
"91","37.255987291","172.16.40.1","172.16.1.10","TCP","66","33450  >  21 [ACK] Seq=30 Ack=396 Win=64128 Len=0 TSval=3491553999 TSecr=2823996852"
"92","37.737484729","172.16.40.1","172.16.1.10","TCP","74","33466  >  21 [SYN] Seq=0 Win=64240 Len=0 MSS=1460 SACK_PERM=1 TSval=3491554480 TSecr=0 WS=128"
"93","37.737864120","172.16.1.10","172.16.40.1","TCP","74","21  >  33466 [SYN, ACK] Seq=0 Ack=1 Win=65160 Len=0 MSS=1460 SACK_PERM=1 TSval=2823997334 TSecr=3491554480 WS=128"
"94","37.737900159","172.16.40.1","172.16.1.10","TCP","66","33466  >  21 [ACK] Seq=1 Ack=1 Win=64256 Len=0 TSval=3491554481 TSecr=2823997334"
"95","37.742920652","172.16.1.10","172.16.40.1","FTP","116","Response: 220 ProFTPD Server (Debian) [::ffff:172.16.1.10]"
"96","37.742932944","172.16.40.1","172.16.1.10","TCP","66","33466  >  21 [ACK] Seq=1 Ack=51 Win=64256 Len=0 TSval=3491554486 TSecr=2823997339"
"97","37.742975968","172.16.40.1","172.16.1.10","FTP","77","Request: USER rcom"
"98","37.743398312","172.16.1.10","172.16.40.1","TCP","66","21  >  33466 [ACK] Seq=51 Ack=12 Win=65280 Len=0 TSval=2823997340 TSecr=3491554486"
"99","37.744194109","172.16.1.10","172.16.40.1","FTP","98","Response: 331 Password required for rcom"
"100","37.744233571","172.16.40.1","172.16.1.10","FTP","77","Request: PASS rcom"
"101","37.786100441","172.16.1.10","172.16.40.1","TCP","66","21  >  33466 [ACK] Seq=83 Ack=23 Win=65280 Len=0 TSval=2823997383 TSecr=3491554487"
"102","37.925607460","172.16.1.10","172.16.40.1","FTP","112","Response: 230-Welcome, archive user rcom@172.16.1.41 !"
"103","37.925610394","172.16.1.10","172.16.40.1","FTP","69","Response:  "
"104","37.925631207","172.16.1.10","172.16.40.1","FTP","112","Response:  The local time is: Fri Dec 13 11:39:52 2024"
"105","37.925670040","172.16.40.1","172.16.1.10","TCP","66","33466  >  21 [ACK] Seq=23 Ack=178 Win=64256 Len=0 TSval=3491554668 TSecr=2823997522"
"106","37.925677793","172.16.40.1","172.16.1.10","TCP","66","[TCP Dup ACK 105#1] 33466  >  21 [ACK] Seq=23 Ack=178 Win=64256 Len=0 TSval=3491554668 TSecr=2823997522"
"107","37.925679678","172.16.40.1","172.16.1.10","TCP","66","[TCP Dup ACK 105#2] 33466  >  21 [ACK] Seq=23 Ack=178 Win=64256 Len=0 TSval=3491554668 TSecr=2823997522"
"108","37.925677094","172.16.1.10","172.16.40.1","FTP","142","Response:  "
"109","37.925703076","172.16.1.10","172.16.40.1","FTP","129","Response:  please report them via e-mail to <root@ftp.netlab.fe.up.pt>."
"110","37.925736741","172.16.40.1","172.16.1.10","FTP","72","Request: PASV"
"111","37.925748754","172.16.1.10","172.16.40.1","FTP","94","Response:  "
"112","37.926086377","172.16.1.10","172.16.40.1","TCP","66","21  >  33466 [ACK] Seq=345 Ack=29 Win=65280 Len=0 TSval=2823997523 TSecr=3491554668"
"113","37.926647570","172.16.1.10","172.16.40.1","FTP","116","Response: 227 Entering Passive Mode (172,16,1,10,179,125)."
"114","37.926664612","172.16.40.1","172.16.1.10","TCP","66","33466  >  21 [ACK] Seq=29 Ack=395 Win=64128 Len=0 TSval=3491554669 TSecr=2823997522"
"115","38.041508271","Routerbo_1c:8b:bd","Spanning-tree-(for-bridges)_00","STP","60","RST. Root = 32768/0/c4:ad:34:1c:8b:bd  Cost = 0  Port = 0x8001"
"116","38.324547540","Kye_02:55:95","3Com_9f:81:2e","ARP","60","Who has 172.16.40.1? Tell 172.16.40.254"
"117","38.324563116","3Com_9f:81:2e","Kye_02:55:95","ARP","42","172.16.40.1 is at 00:01:02:9f:81:2e"
"118","38.647365850","172.16.40.1","172.16.1.10","TCP","66","33466  >  21 [FIN, ACK] Seq=29 Ack=395 Win=64128 Len=0 TSval=3491555390 TSecr=2823997522"
"119","38.648033415","172.16.1.10","172.16.40.1","TCP","66","21  >  33466 [FIN, ACK] Seq=395 Ack=30 Win=65280 Len=0 TSval=2823998244 TSecr=3491555390"
"120","38.648072457","172.16.40.1","172.16.1.10","TCP","66","33466  >  21 [ACK] Seq=30 Ack=396 Win=64128 Len=0 TSval=3491555391 TSecr=2823998244"
"121","39.017768774","172.16.40.1","172.16.1.10","TCP","74","33480  >  21 [SYN] Seq=0 Win=64240 Len=0 MSS=1460 SACK_PERM=1 TSval=3491555760 TSecr=0 WS=128"
"122","39.018189930","172.16.1.10","172.16.40.1","TCP","74","21  >  33480 [SYN, ACK] Seq=0 Ack=1 Win=65160 Len=0 MSS=1460 SACK_PERM=1 TSval=2823998615 TSecr=3491555760 WS=128"
"123","39.018211163","172.16.40.1","172.16.1.10","TCP","66","33480  >  21 [ACK] Seq=1 Ack=1 Win=64256 Len=0 TSval=3491555761 TSecr=2823998615"
"124","39.056656539","172.16.1.10","172.16.40.1","FTP","116","Response: 220 ProFTPD Server (Debian) [::ffff:172.16.1.10]"
"125","39.056690693","172.16.40.1","172.16.1.10","TCP","66","33480  >  21 [ACK] Seq=1 Ack=51 Win=64256 Len=0 TSval=3491555799 TSecr=2823998653"
"126","39.056777718","172.16.40.1","172.16.1.10","FTP","77","Request: USER rcom"
"127","39.057079861","172.16.1.10","172.16.40.1","TCP","66","21  >  33480 [ACK] Seq=51 Ack=12 Win=65280 Len=0 TSval=2823998654 TSecr=3491555799"
"128","39.057687709","172.16.1.10","172.16.40.1","FTP","98","Response: 331 Password required for rcom"
"129","39.057728777","172.16.40.1","172.16.1.10","FTP","77","Request: PASS rcom"
"130","39.106074058","172.16.1.10","172.16.40.1","TCP","66","21  >  33480 [ACK] Seq=83 Ack=23 Win=65280 Len=0 TSval=2823998703 TSecr=3491555800"
"131","39.241591554","172.16.1.10","172.16.40.1","FTP","112","Response: 230-Welcome, archive user rcom@172.16.1.41 !"
"132","39.241592881","172.16.1.10","172.16.40.1","FTP","69","Response:  "
"133","39.241614742","172.16.1.10","172.16.40.1","FTP","112","Response:  The local time is: Fri Dec 13 11:39:53 2024"
"134","39.241643866","172.16.40.1","172.16.1.10","TCP","66","33480  >  21 [ACK] Seq=23 Ack=178 Win=64256 Len=0 TSval=3491555984 TSecr=2823998838"
"135","39.241663423","172.16.1.10","172.16.40.1","FTP","142","Response:  "
"136","39.241690452","172.16.1.10","172.16.40.1","FTP","129","Response:  please report them via e-mail to <root@ftp.netlab.fe.up.pt>."
"137","39.241724605","172.16.1.10","172.16.40.1","FTP","94","Response:  "
"138","39.241740390","172.16.40.1","172.16.1.10","FTP","72","Request: PASV"
"139","39.242092751","172.16.1.10","172.16.40.1","TCP","66","21  >  33480 [ACK] Seq=345 Ack=29 Win=65280 Len=0 TSval=2823998839 TSecr=3491555984"
"140","39.242765973","172.16.1.10","172.16.40.1","FTP","116","Response: 227 Entering Passive Mode (172,16,1,10,135,255)."
"141","39.242846572","172.16.40.1","172.16.1.10","TCP","74","49686  >  34815 [SYN] Seq=0 Win=64240 Len=0 MSS=1460 SACK_PERM=1 TSval=3491555986 TSecr=0 WS=128"
"142","39.243249011","172.16.1.10","172.16.40.1","TCP","74","34815  >  49686 [SYN, ACK] Seq=0 Ack=1 Win=65160 Len=0 MSS=1460 SACK_PERM=1 TSval=2823998840 TSecr=3491555986 WS=128"
"143","39.243265075","172.16.40.1","172.16.1.10","TCP","66","49686  >  34815 [ACK] Seq=1 Ack=1 Win=64256 Len=0 TSval=3491555986 TSecr=2823998840"
"144","39.243290637","172.16.40.1","172.16.1.10","FTP","79","Request: RETR README"
"145","39.244287235","172.16.1.10","172.16.40.1","FTP","128","Response: 150 Opening ASCII mode data connection for README (58 bytes)"
"146","39.244392349","172.16.1.10","172.16.40.1","FTP-DATA","128","FTP Data: 62 bytes (PASV) (RETR README)"
"147","39.244402547","172.16.40.1","172.16.1.10","TCP","66","49686  >  34815 [ACK] Seq=1 Ack=63 Win=64256 Len=0 TSval=3491555987 TSecr=2823998841"
"148","39.244432160","172.16.1.10","172.16.40.1","TCP","66","34815  >  49686 [FIN, ACK] Seq=63 Ack=1 Win=65280 Len=0 TSval=2823998841 TSecr=3491555986"
"149","39.285602275","172.16.40.1","172.16.1.10","TCP","66","49686  >  34815 [ACK] Seq=1 Ack=64 Win=64256 Len=0 TSval=3491556028 TSecr=2823998841"
"150","39.285614916","172.16.40.1","172.16.1.10","TCP","66","33480  >  21 [ACK] Seq=42 Ack=457 Win=64128 Len=0 TSval=3491556028 TSecr=2823998841"
"151","40.043670957","Routerbo_1c:8b:bd","Spanning-tree-(for-bridges)_00","STP","60","RST. Root = 32768/0/c4:ad:34:1c:8b:bd  Cost = 0  Port = 0x8001"
"152","42.045832390","Routerbo_1c:8b:bd","Spanning-tree-(for-bridges)_00","STP","60","RST. Root = 32768/0/c4:ad:34:1c:8b:bd  Cost = 0  Port = 0x8001"
"153","44.048010378","Routerbo_1c:8b:bd","Spanning-tree-(for-bridges)_00","STP","60","RST. Root = 32768/0/c4:ad:34:1c:8b:bd  Cost = 0  Port = 0x8001"
"154","46.050189207","Routerbo_1c:8b:bd","Spanning-tree-(for-bridges)_00","STP","60","RST. Root = 32768/0/c4:ad:34:1c:8b:bd  Cost = 0  Port = 0x8001"
"155","48.052379842","Routerbo_1c:8b:bd","Spanning-tree-(for-bridges)_00","STP","60","RST. Root = 32768/0/c4:ad:34:1c:8b:bd  Cost = 0  Port = 0x8001"
"156","50.046436775","172.16.1.10","172.16.40.1","FTP","89","Response: 226 Transfer complete"
"157","50.046473583","172.16.40.1","172.16.1.10","TCP","66","33480  >  21 [ACK] Seq=42 Ack=480 Win=64128 Len=0 TSval=3491566789 TSecr=2824009643"
"158","50.046548106","172.16.40.1","172.16.1.10","FTP","72","Request: QUIT"
"159","50.047076892","172.16.1.10","172.16.40.1","FTP","80","Response: 221 Goodbye."
"160","50.047122430","172.16.40.1","172.16.1.10","TCP","66","33480  >  21 [FIN, ACK] Seq=48 Ack=494 Win=64128 Len=0 TSval=3491566790 TSecr=2824009644"
"161","50.047147504","172.16.40.1","172.16.1.10","TCP","66","49686  >  34815 [FIN, ACK] Seq=1 Ack=64 Win=64256 Len=0 TSval=3491566790 TSecr=2823998841"
"162","50.047249824","172.16.1.10","172.16.40.1","TCP","66","21  >  33480 [FIN, ACK] Seq=494 Ack=48 Win=65280 Len=0 TSval=2824009644 TSecr=3491566789"
"163","50.047260091","172.16.40.1","172.16.1.10","TCP","66","33480  >  21 [ACK] Seq=49 Ack=495 Win=64128 Len=0 TSval=3491566790 TSecr=2824009644"
"164","50.047409417","172.16.1.10","172.16.40.1","TCP","66","21  >  33480 [ACK] Seq=495 Ack=49 Win=65280 Len=0 TSval=2824009644 TSecr=3491566790"
"165","50.054544426","Routerbo_1c:8b:bd","Spanning-tree-(for-bridges)_00","STP","60","RST. Root = 32768/0/c4:ad:34:1c:8b:bd  Cost = 0  Port = 0x8001"
"166","50.253604327","172.16.40.1","172.16.1.10","TCP","66","[TCP Retransmission] 49686  >  34815 [FIN, ACK] Seq=1 Ack=64 Win=64256 Len=0 TSval=3491566996 TSecr=2823998841"
"167","50.461604066","172.16.40.1","172.16.1.10","TCP","66","[TCP Retransmission] 49686  >  34815 [FIN, ACK] Seq=1 Ack=64 Win=64256 Len=0 TSval=3491567204 TSecr=2823998841"
"168","50.885617814","172.16.40.1","172.16.1.10","TCP","66","[TCP Retransmission] 49686  >  34815 [FIN, ACK] Seq=1 Ack=64 Win=64256 Len=0 TSval=3491567628 TSecr=2823998841"
"169","51.717605477","172.16.40.1","172.16.1.10","TCP","66","[TCP Retransmission] 49686  >  34815 [FIN, ACK] Seq=1 Ack=64 Win=64256 Len=0 TSval=3491568460 TSecr=2823998841"
"170","52.056702936","Routerbo_1c:8b:bd","Spanning-tree-(for-bridges)_00","STP","60","RST. Root = 32768/0/c4:ad:34:1c:8b:bd  Cost = 0  Port = 0x8001"
"171","53.381611743","172.16.40.1","172.16.1.10","TCP","66","[TCP Retransmission] 49686  >  34815 [FIN, ACK] Seq=1 Ack=64 Win=64256 Len=0 TSval=3491570124 TSecr=2823998841"
"172","54.058883865","Routerbo_1c:8b:bd","Spanning-tree-(for-bridges)_00","STP","60","RST. Root = 32768/0/c4:ad:34:1c:8b:bd  Cost = 0  Port = 0x8001"
"173","56.061057112","Routerbo_1c:8b:bd","Spanning-tree-(for-bridges)_00","STP","60","RST. Root = 32768/0/c4:ad:34:1c:8b:bd  Cost = 0  Port = 0x8001"
"174","56.901606632","172.16.40.1","172.16.1.10","TCP","66","[TCP Retransmission] 49686  >  34815 [FIN, ACK] Seq=1 Ack=64 Win=64256 Len=0 TSval=3491573644 TSecr=2823998841"
"175","58.063238460","Routerbo_1c:8b:bd","Spanning-tree-(for-bridges)_00","STP","60","RST. Root = 32768/0/c4:ad:34:1c:8b:bd  Cost = 0  Port = 0x8001"
"176","60.065403882","Routerbo_1c:8b:bd","Spanning-tree-(for-bridges)_00","STP","60","RST. Root = 32768/0/c4:ad:34:1c:8b:bd  Cost = 0  Port = 0x8001"
"177","62.067170286","Routerbo_1c:8b:bd","Spanning-tree-(for-bridges)_00","STP","60","RST. Root = 32768/0/c4:ad:34:1c:8b:bd  Cost = 0  Port = 0x8001"
"178","63.557615244","172.16.40.1","172.16.1.10","TCP","66","[TCP Retransmission] 49686  >  34815 [FIN, ACK] Seq=1 Ack=64 Win=64256 Len=0 TSval=3491580300 TSecr=2823998841"
"179","64.069757770","Routerbo_1c:8b:bd","Spanning-tree-(for-bridges)_00","STP","60","RST. Root = 32768/0/c4:ad:34:1c:8b:bd  Cost = 0  Port = 0x8001"
"180","64.201884267","172.16.40.1","172.16.40.255","NBNS","92","Name query NB WORKGROUP<1d>"
"181","65.203435962","172.16.40.1","172.16.40.255","NBNS","92","Name query NB WORKGROUP<1b>"
"182","66.071936665","Routerbo_1c:8b:bd","Spanning-tree-(for-bridges)_00","STP","60","RST. Root = 32768/0/c4:ad:34:1c:8b:bd  Cost = 0  Port = 0x8001"
"183","66.206880872","172.16.40.1","172.16.40.255","NBNS","92","Name query NB WORKGROUP<20>"
"184","67.210051819","172.16.40.1","172.16.40.255","NBNS","92","Name query NB WORKGROUP<1d>"
"185","67.363718939","fe80::201:2ff:fe9f:812e","ff02::fb","MDNS","180","Standard query 0x0000 PTR _ftp._tcp.local, ""QM"" question PTR _nfs._tcp.local, ""QM"" question PTR _afpovertcp._tcp.local, ""QM"" question PTR _smb._tcp.local, ""QM"" question PTR _sftp-ssh._tcp.local, ""QM"" question PTR _webdavs._tcp.local, ""QM"" question PTR _webdav._tcp.local, ""QM"" question"
"186","67.363789830","172.16.40.1","224.0.0.251","MDNS","160","Standard query 0x0000 PTR _ftp._tcp.local, ""QM"" question PTR _nfs._tcp.local, ""QM"" question PTR _afpovertcp._tcp.local, ""QM"" question PTR _smb._tcp.local, ""QM"" question PTR _sftp-ssh._tcp.local, ""QM"" question PTR _webdavs._tcp.local, ""QM"" question PTR _webdav._tcp.local, ""QM"" question"
"187","68.074121424","Routerbo_1c:8b:bd","Spanning-tree-(for-bridges)_00","STP","60","RST. Root = 32768/0/c4:ad:34:1c:8b:bd  Cost = 0  Port = 0x8001"
"188","68.211440043","172.16.40.1","172.16.40.255","NBNS","92","Name query NB WORKGROUP<1b>"
"189","68.365251464","fe80::201:2ff:fe9f:812e","ff02::fb","MDNS","180","Standard query 0x0000 PTR _ftp._tcp.local, ""QM"" question PTR _nfs._tcp.local, ""QM"" question PTR _afpovertcp._tcp.local, ""QM"" question PTR _smb._tcp.local, ""QM"" question PTR _sftp-ssh._tcp.local, ""QM"" question PTR _webdavs._tcp.local, ""QM"" question PTR _webdav._tcp.local, ""QM"" question"
"190","68.365319841","172.16.40.1","224.0.0.251","MDNS","160","Standard query 0x0000 PTR _ftp._tcp.local, ""QM"" question PTR _nfs._tcp.local, ""QM"" question PTR _afpovertcp._tcp.local, ""QM"" question PTR _smb._tcp.local, ""QM"" question PTR _sftp-ssh._tcp.local, ""QM"" question PTR _webdavs._tcp.local, ""QM"" question PTR _webdav._tcp.local, ""QM"" question"
"191","69.213936370","172.16.40.1","172.16.40.255","NBNS","92","Name query NB WORKGROUP<20>"
"192","70.076194010","Routerbo_1c:8b:bd","Spanning-tree-(for-bridges)_00","STP","60","RST. Root = 32768/0/c4:ad:34:1c:8b:bd  Cost = 0  Port = 0x8001"
"193","70.367589196","fe80::201:2ff:fe9f:812e","ff02::fb","MDNS","180","Standard query 0x0000 PTR _ftp._tcp.local, ""QM"" question PTR _nfs._tcp.local, ""QM"" question PTR _afpovertcp._tcp.local, ""QM"" question PTR _smb._tcp.local, ""QM"" question PTR _sftp-ssh._tcp.local, ""QM"" question PTR _webdavs._tcp.local, ""QM"" question PTR _webdav._tcp.local, ""QM"" question"
"194","70.367660157","172.16.40.1","224.0.0.251","MDNS","160","Standard query 0x0000 PTR _ftp._tcp.local, ""QM"" question PTR _nfs._tcp.local, ""QM"" question PTR _afpovertcp._tcp.local, ""QM"" question PTR _smb._tcp.local, ""QM"" question PTR _sftp-ssh._tcp.local, ""QM"" question PTR _webdavs._tcp.local, ""QM"" question PTR _webdav._tcp.local, ""QM"" question"
"195","72.078378829","Routerbo_1c:8b:bd","Spanning-tree-(for-bridges)_00","STP","60","RST. Root = 32768/0/c4:ad:34:1c:8b:bd  Cost = 0  Port = 0x8001"
"196","74.080552819","Routerbo_1c:8b:bd","Spanning-tree-(for-bridges)_00","STP","60","RST. Root = 32768/0/c4:ad:34:1c:8b:bd  Cost = 0  Port = 0x8001"
"197","74.371963759","fe80::201:2ff:fe9f:812e","ff02::fb","MDNS","180","Standard query 0x0000 PTR _ftp._tcp.local, ""QM"" question PTR _nfs._tcp.local, ""QM"" question PTR _afpovertcp._tcp.local, ""QM"" question PTR _smb._tcp.local, ""QM"" question PTR _sftp-ssh._tcp.local, ""QM"" question PTR _webdavs._tcp.local, ""QM"" question PTR _webdav._tcp.local, ""QM"" question"
"198","74.372034301","172.16.40.1","224.0.0.251","MDNS","160","Standard query 0x0000 PTR _ftp._tcp.local, ""QM"" question PTR _nfs._tcp.local, ""QM"" question PTR _afpovertcp._tcp.local, ""QM"" question PTR _smb._tcp.local, ""QM"" question PTR _sftp-ssh._tcp.local, ""QM"" question PTR _webdavs._tcp.local, ""QM"" question PTR _webdav._tcp.local, ""QM"" question"
"199","76.082690833","Routerbo_1c:8b:bd","Spanning-tree-(for-bridges)_00","STP","60","RST. Root = 32768/0/c4:ad:34:1c:8b:bd  Cost = 0  Port = 0x8001"
