"No.","Time","Source","Destination","Protocol","Length","Info"
"1","0.000000000","Routerbo_1c:8b:bd","Spanning-tree-(for-bridges)_00","STP","60","RST. Root = 32768/0/c4:ad:34:1c:8b:be  Cost = 0  Port = 0x8002"
"2","2.002120632","Routerbo_1c:8b:bd","Spanning-tree-(for-bridges)_00","STP","60","RST. Root = 32768/0/c4:ad:34:1c:8b:be  Cost = 0  Port = 0x8002"
"3","3.994209167","Routerbo_1c:8b:bd","Spanning-tree-(for-bridges)_00","STP","60","RST. Root = 32768/0/c4:ad:34:1c:8b:be  Cost = 0  Port = 0x8002"
"4","4.811417410","172.16.40.1","172.16.1.10","TCP","74","33828  >  21 [SYN] Seq=0 Win=64240 Len=0 MSS=1460 SACK_PERM=1 TSval=3519019200 TSecr=0 WS=128"
"5","4.811922231","172.16.1.10","172.16.40.1","TCP","74","21  >  33828 [SYN, ACK] Seq=0 Ack=1 Win=65160 Len=0 MSS=1460 SACK_PERM=1 TSval=843867425 TSecr=3519019200 WS=128"
"6","4.811948422","172.16.40.1","172.16.1.10","TCP","66","33828  >  21 [ACK] Seq=1 Ack=1 Win=64256 Len=0 TSval=3519019200 TSecr=843867425"
"7","4.819064109","172.16.1.10","172.16.40.1","FTP","116","Response: 220 ProFTPD Server (Debian) [::ffff:172.16.1.10]"
"8","4.819076750","172.16.40.1","172.16.1.10","TCP","66","33828  >  21 [ACK] Seq=1 Ack=51 Win=64256 Len=0 TSval=3519019207 TSecr=843867433"
"9","4.819116910","172.16.40.1","172.16.1.10","FTP","77","Request: USER rcom"
"10","4.819392718","172.16.1.10","172.16.40.1","TCP","66","21  >  33828 [ACK] Seq=51 Ack=12 Win=65280 Len=0 TSval=843867433 TSecr=3519019207"
"11","4.820256389","172.16.1.10","172.16.40.1","FTP","98","Response: 331 Password required for rcom"
"12","4.820294593","172.16.40.1","172.16.1.10","FTP","77","Request: PASS rcom"
"13","4.863005756","172.16.1.10","172.16.40.1","TCP","66","21  >  33828 [ACK] Seq=83 Ack=23 Win=65280 Len=0 TSval=843867477 TSecr=3519019209"
"14","4.967962523","172.16.1.10","172.16.40.1","FTP","112","Response: 230-Welcome, archive user rcom@172.16.1.41 !"
"15","4.967983825","172.16.1.10","172.16.40.1","FTP","115","Response:  "
"16","4.968045775","172.16.40.1","172.16.1.10","FTP","72","Request: PASV"
"17","4.968060652","172.16.1.10","172.16.40.1","FTP","142","Response:  "
"18","4.968104932","172.16.1.10","172.16.40.1","FTP","157","Response:  please report them via e-mail to <root@ftp.netlab.fe.up.pt>."
"19","4.968121135","172.16.40.1","172.16.1.10","TCP","66","33828  >  21 [ACK] Seq=29 Ack=345 Win=64128 Len=0 TSval=3519019356 TSecr=843867582"
"20","4.968409794","172.16.1.10","172.16.40.1","TCP","66","21  >  33828 [ACK] Seq=345 Ack=29 Win=65280 Len=0 TSval=843867582 TSecr=3519019356"
"21","4.968851198","172.16.1.10","172.16.40.1","FTP","116","Response: 227 Entering Passive Mode (172,16,1,10,179,171)."
"22","4.968929212","172.16.40.1","172.16.1.10","TCP","74","55956  >  45995 [SYN] Seq=0 Win=64240 Len=0 MSS=1460 SACK_PERM=1 TSval=3519019357 TSecr=0 WS=128"
"23","4.969303149","172.16.1.10","172.16.40.1","TCP","74","45995  >  55956 [SYN, ACK] Seq=0 Ack=1 Win=65160 Len=0 MSS=1460 SACK_PERM=1 TSval=843867583 TSecr=3519019357 WS=128"
"24","4.969321238","172.16.40.1","172.16.1.10","TCP","66","55956  >  45995 [ACK] Seq=1 Ack=1 Win=64256 Len=0 TSval=3519019358 TSecr=843867583"
"25","4.969332832","172.16.40.1","172.16.1.10","FTP","79","Request: RETR README"
"26","4.970222764","172.16.1.10","172.16.40.1","FTP","128","Response: 150 Opening ASCII mode data connection for README (58 bytes)"
"27","4.970334163","172.16.1.10","172.16.40.1","FTP-DATA","128","FTP Data: 62 bytes (PASV) (RETR README)"
"28","4.970343871","172.16.40.1","172.16.1.10","TCP","66","55956  >  45995 [ACK] Seq=1 Ack=63 Win=64256 Len=0 TSval=3519019359 TSecr=843867584"
"29","4.970381586","172.16.1.10","172.16.40.1","TCP","66","45995  >  55956 [FIN, ACK] Seq=63 Ack=1 Win=65280 Len=0 TSval=843867584 TSecr=3519019358"
"30","5.011009838","172.16.40.1","172.16.1.10","TCP","66","55956  >  45995 [ACK] Seq=1 Ack=64 Win=64256 Len=0 TSval=3519019399 TSecr=843867584"
"31","5.011023667","172.16.40.1","172.16.1.10","TCP","66","33828  >  21 [ACK] Seq=42 Ack=457 Win=64128 Len=0 TSval=3519019399 TSecr=843867584"
"32","5.996334271","Routerbo_1c:8b:bd","Spanning-tree-(for-bridges)_00","STP","60","RST. Root = 32768/0/c4:ad:34:1c:8b:be  Cost = 0  Port = 0x8002"
"33","7.998476837","Routerbo_1c:8b:bd","Spanning-tree-(for-bridges)_00","STP","60","RST. Root = 32768/0/c4:ad:34:1c:8b:be  Cost = 0  Port = 0x8002"
"34","10.000570305","Routerbo_1c:8b:bd","Spanning-tree-(for-bridges)_00","STP","60","RST. Root = 32768/0/c4:ad:34:1c:8b:be  Cost = 0  Port = 0x8002"
"35","10.042630886","Kye_02:55:95","3Com_9f:81:2e","ARP","60","Who has 172.16.40.1? Tell 172.16.40.254"
"36","10.042643318","3Com_9f:81:2e","Kye_02:55:95","ARP","42","172.16.40.1 is at 00:01:02:9f:81:2e"
"37","12.002699115","Routerbo_1c:8b:bd","Spanning-tree-(for-bridges)_00","STP","60","RST. Root = 32768/0/c4:ad:34:1c:8b:be  Cost = 0  Port = 0x8002"
"38","13.994693300","Routerbo_1c:8b:bd","Spanning-tree-(for-bridges)_00","STP","60","RST. Root = 32768/0/c4:ad:34:1c:8b:be  Cost = 0  Port = 0x8002"
"39","15.772518662","172.16.1.10","172.16.40.1","FTP","89","Response: 226 Transfer complete"
"40","15.772558402","172.16.40.1","172.16.1.10","TCP","66","33828  >  21 [ACK] Seq=42 Ack=480 Win=64128 Len=0 TSval=3519030161 TSecr=843878387"
"41","15.772612740","172.16.40.1","172.16.1.10","FTP","72","Request: QUIT"
"42","15.773249563","172.16.1.10","172.16.40.1","FTP","80","Response: 221 Goodbye."
"43","15.773293284","172.16.40.1","172.16.1.10","TCP","66","33828  >  21 [FIN, ACK] Seq=48 Ack=494 Win=64128 Len=0 TSval=3519030162 TSecr=843878387"
"44","15.773309907","172.16.40.1","172.16.1.10","TCP","66","55956  >  45995 [FIN, ACK] Seq=1 Ack=64 Win=64256 Len=0 TSval=3519030162 TSecr=843867584"
"45","15.773312351","172.16.40.1","172.16.1.10","TCP","66","[TCP Out-Of-Order] 55956  >  45995 [FIN, ACK] Seq=1 Ack=64 Win=64256 Len=0 TSval=3519030162 TSecr=843867584"
"46","15.773314027","172.16.40.1","172.16.1.10","TCP","66","[TCP Out-Of-Order] 55956  >  45995 [FIN, ACK] Seq=1 Ack=64 Win=64256 Len=0 TSval=3519030162 TSecr=843867584"
"47","15.773517618","172.16.1.10","172.16.40.1","TCP","66","21  >  33828 [FIN, ACK] Seq=494 Ack=48 Win=65280 Len=0 TSval=843878388 TSecr=3519030161"
"48","15.773529352","172.16.40.1","172.16.1.10","TCP","66","33828  >  21 [ACK] Seq=49 Ack=495 Win=64128 Len=0 TSval=3519030162 TSecr=843878388"
"49","15.773580965","172.16.1.10","172.16.40.1","TCP","66","21  >  33828 [ACK] Seq=495 Ack=49 Win=65280 Len=0 TSval=843878388 TSecr=3519030162"
"50","15.974959265","172.16.40.1","172.16.1.10","TCP","66","[TCP Retransmission] 55956  >  45995 [FIN, ACK] Seq=1 Ack=64 Win=64256 Len=0 TSval=3519030363 TSecr=843867584"
"51","15.996801509","Routerbo_1c:8b:bd","Spanning-tree-(for-bridges)_00","STP","60","RST. Root = 32768/0/c4:ad:34:1c:8b:be  Cost = 0  Port = 0x8002"
"52","16.178950371","172.16.40.1","172.16.1.10","TCP","66","[TCP Retransmission] 55956  >  45995 [FIN, ACK] Seq=1 Ack=64 Win=64256 Len=0 TSval=3519030567 TSecr=843867584"
"53","16.594975637","172.16.40.1","172.16.1.10","TCP","66","[TCP Retransmission] 55956  >  45995 [FIN, ACK] Seq=1 Ack=64 Win=64256 Len=0 TSval=3519030983 TSecr=843867584"
"54","17.426961636","172.16.40.1","172.16.1.10","TCP","66","[TCP Retransmission] 55956  >  45995 [FIN, ACK] Seq=1 Ack=64 Win=64256 Len=0 TSval=3519031815 TSecr=843867584"
"55","17.998929485","Routerbo_1c:8b:bd","Spanning-tree-(for-bridges)_00","STP","60","RST. Root = 32768/0/c4:ad:34:1c:8b:be  Cost = 0  Port = 0x8002"
"56","19.062963204","172.16.40.1","172.16.1.10","TCP","66","[TCP Retransmission] 55956  >  45995 [FIN, ACK] Seq=1 Ack=64 Win=64256 Len=0 TSval=3519033451 TSecr=843867584"
"57","20.001034345","Routerbo_1c:8b:bd","Spanning-tree-(for-bridges)_00","STP","60","RST. Root = 32768/0/c4:ad:34:1c:8b:be  Cost = 0  Port = 0x8002"
"58","22.003174197","Routerbo_1c:8b:bd","Spanning-tree-(for-bridges)_00","STP","60","RST. Root = 32768/0/c4:ad:34:1c:8b:be  Cost = 0  Port = 0x8002"
"59","22.514966713","172.16.40.1","172.16.1.10","TCP","66","[TCP Retransmission] 55956  >  45995 [FIN, ACK] Seq=1 Ack=64 Win=64256 Len=0 TSval=3519036903 TSecr=843867584"
"60","24.005252589","Routerbo_1c:8b:bd","Spanning-tree-(for-bridges)_00","STP","60","RST. Root = 32768/0/c4:ad:34:1c:8b:be  Cost = 0  Port = 0x8002"
"61","26.007393701","Routerbo_1c:8b:bd","Spanning-tree-(for-bridges)_00","STP","60","RST. Root = 32768/0/c4:ad:34:1c:8b:be  Cost = 0  Port = 0x8002"
"62","28.009547037","Routerbo_1c:8b:bd","Spanning-tree-(for-bridges)_00","STP","60","RST. Root = 32768/0/c4:ad:34:1c:8b:be  Cost = 0  Port = 0x8002"
